{
  "schema_version": "GameEngine.RendererMetalMemoryProfilingHostEvidence.v1",
  "claim_id": "renderer-metal-memory-profiling-host-evidence-v1",
  "host": {
    "platform": "macos",
    "macos_version": "macOS 15.5",
    "xcode_version": "Xcode 16.4",
    "full_xcode_selected": true,
    "metal_tool_ready": true,
    "metallib_tool_ready": true
  },
  "source_rows": {
    "heap_documentation_source_id": "Apple-Metal-MTLHeap-2026-06-24",
    "residency_set_documentation_source_id": "Apple-Metal-MTLResidencySet-2026-06-24",
    "residency_request_documentation_source_id": "Apple-Metal-MTLResidencySet-requestResidency-2026-06-24",
    "command_queue_residency_documentation_source_id": "Apple-Metal-MTLCommandQueue-addResidencySet-2026-06-24",
    "capture_manager_documentation_source_id": "Apple-Metal-MTLCaptureManager-2026-06-24",
    "programmatic_capture_documentation_source_id": "Apple-Metal-ProgrammaticCapture-2026-06-24"
  },
  "memory_residency_row": {
    "proof_row_id": "memory_residency",
    "host_validation_recipe_id": "renderer-metal-memory-profiling-host-evidence",
    "first_party_workload_id": "sample_desktop_runtime_game.renderer_metal_memory_profiling_fixture",
    "runtime_ready": true,
    "command_queue_ready": true,
    "heap_api_name": "MTLHeap",
    "heap_allocation_ready": true,
    "heap_resource_allocation_ready": true,
    "heap_resource_rows": 2,
    "heap_allocated_bytes": 4194304,
    "resident_bytes": 3145728,
    "budget_bytes": 8388608,
    "residency_api_name": "MTLResidencySet",
    "residency_set_ready": true,
    "residency_set_allocation_rows": 1,
    "residency_request_ready": true,
    "residency_commit_ready": true,
    "command_queue_residency_set_committed": true,
    "residency_pressure_evidence_ready": true,
    "memory_pressure_sample_rows": 2,
    "memory_pressure_budget_status": "within_budget"
  },
  "profiling_capture_row": {
    "proof_row_id": "profiling_capture",
    "host_validation_recipe_id": "renderer-metal-memory-profiling-host-evidence",
    "first_party_workload_id": "sample_desktop_runtime_game.renderer_metal_memory_profiling_fixture",
    "runtime_ready": true,
    "command_queue_ready": true,
    "capture_api_name": "MTLCaptureManager",
    "capture_manager_ready": true,
    "capture_descriptor_ready": true,
    "capture_object_ready": true,
    "capture_scope_ready": true,
    "capture_scope_label": "RendererMetalMemoryProfilingFixture",
    "capture_boundary_ready": true,
    "capture_started": true,
    "capture_stopped": true,
    "command_buffer_captured": true,
    "capture_artifact_path": "capture-summary.txt",
    "capture_artifact_hash_sha256": "f68c430af51e49516a3a5fd4bb8e1fd38ec26989f8f7efbd3f92fac5a99a2993",
    "deterministic_capture_hash_sha256": "f68c430af51e49516a3a5fd4bb8e1fd38ec26989f8f7efbd3f92fac5a99a2993",
    "capture_artifact_rows": 1
  },
  "non_claims": {
    "simulator_only_evidence": false,
    "cross_backend_inference": false,
    "native_handles_exposed": false,
    "broad_backend_parity_ready": false,
    "broad_metal_readiness": false,
    "commercial_renderer_readiness": false,
    "broad_renderer_quality": false,
    "environment_ready": false,
    "external_engine_api_parity": false
  }
}
